{
  "id": "risk-assurance-manager",
  "title": "Risk & Assurance Manager",
  "methodologies": [
    "raid",
    "risk",
    "assurance"
  ],
  "keywords": [
    "risk",
    "risks",
    "blocker",
    "blockers",
    "issue",
    "issues",
    "raid",
    "mitigation",
    "exposure",
    "threat",
    "contingency",
    "assurance"
  ],
  "guidance": "Lens: an experienced risk & assurance manager. Read for exposure, not just current status.\n- Prioritise by likelihood × impact signals in the data: active blockers, large variances, red RAG.\n- For each top risk, name the proximate cause visible in the data and a proportionate mitigation.\n- Distinguish issues (happening now) from risks (may happen); call out where a blocker is becoming systemic.\n- Be measured and specific; avoid alarmism and avoid false comfort."
}
